,birth_date,gender,area,title,specialization,salary,education_level,education,language,experience,skill_set,skills
247,29,Женщина,Турция,Комьюнити-менеджер,PR-менеджер,,Высшее образование,2,"['Русский', 'Немецкий', 'Татарский']",1,"[""['Грамотная речь'"", "" 'Деловое общение'"", "" 'Управление проектами'"", "" 'Организаторские навыки'"", "" 'Работа в команде'"", "" 'Умение работать в команде'"", "" 'Креативность'"", "" 'Навыки межличностного общения'"", "" 'Социальные сети'"", "" 'Грамотность'"", "" 'Оперативный поиск информации в сети Интернет'"", "" 'Деловая переписка']""]","Личные качества:
• Легко обучаемая. Могу быстро погрузиться в любой контекст.
• Умею работать в команде. Легко налаживаю контакт с коллегами и руководством.
• Трудолюбивая. Полностью погружаюсь в рабочие процессы.
• Коммуникабельная. Умею общаться с людьми и избегать конфликтных ситуаций.
"
248,33,Женщина,Турция,Администратор,Администратор,,Образование,[],['Русский'],0,"[""['Умение работать в команде'"", "" 'оформление документации']""]",
249,37,Мужчина,Турция,Главный специалист,Директор по информационным технологиям (CIO),,Высшее образование,4,"['Казахский', 'Английский', 'Русский', 'Турецкий']",0,"[""['Windows Server 2008/12 (Active Directory"", ' DNS', ' DHCP', "" WSUS)'"", "" 'McAfee (ePolicy Orchestrator"", ' DLP', ' McAfee Web Gateway', "" Solidcore)'"", "" '1С: Управление Производственным Предприятием'"", "" '1С ТОиР'"", "" '1С: Документооборот']""]","Ответственный, пунктуальный, коммуникабельный, вредных привычек не имею."
250,28,Male,Turkey,System administrator,System administrator,,Higher education,,"['Russian', 'English']",0,"[""['Администрирование сетевого оборудования'"", "" 'Администрирование серверов'"", "" 'Active Directory'"", "" 'Настройка ПК'"", "" 'Настройка ПО'"", "" 'Настройка серверов'"", "" 'Настройка сетевых подключений'"", "" 'Cisco'"", "" 'PowerShell'"", "" 'Linux'"", "" 'Администрирование серверов Linux'"", "" 'IPv6'"", "" 'VMware'"", "" 'VCenter'"", "" 'Zabbix'"", "" 'OpenVPN'"", "" 'GitLab'"", "" 'PostgreSQL'"", "" 'Docker'"", "" 'TCP/IP'"", "" 'Английский язык'"", "" 'Computer troubleshooting'"", "" 'Bash'"", "" 'Администрирование серверов Windows'"", "" 'VPN'"", "" 'Git'"", "" 'CI/CD'"", "" 'Debian'"", "" 'Nginx']""]","I am a system administrator and network engineer with 5 years of experience in configuring and managing networks and server infrastructure. My areas of expertise are administration domain users and group policies, network security, security audit, cloud storage, containerizations, CI/CD, monitoring infrastructure, VPN, IPv6, virtualization, and automatization. I also worked for 2 years as an IT instructor, which gave me experience in people and team management, problem-solving and event management. I am reliable, keen on detail, focused on success, self-motivated, and eager to learn new."
251,26,Женщина,Турция,Менеджер по рекламе,"Менеджер по маркетингу, интернет-маркетолог",,Высшее образование,,"['Русский', 'Английский']",0,"[""['Аналитика продаж'"", "" 'Развитие продаж'"", "" 'Internet Marketing'"", "" 'Управление проектами'"", "" 'Управление персоналом'"", "" 'Анализ бизнес показателей'"", "" 'SWOT анализ'"", "" 'WEB аналитика'"", "" 'Управление продуктовой матрицей'"", "" 'Маркетинговая стратегия'"", "" 'B2C маркетинг'"", "" 'Анализ ассортиментной линейки'"", "" 'Медиапланирование'"", "" 'Интернет-реклама']""]","Мои основные инструменты:
- Яндекс Метрика, Google Analytics, Simillar Web, Я. Wordstat, G.Trends
- Метрики CAC, CRR, CR, CRC, RPR
- Для изучения покупателей — RFM, QFD
- Работа с CJM
- Для изучения маркетинга как системы - расчёт 6 сигм
- Для трекинга задач, документации и вообще всего использую Notion
Дополнительные навыки:
- Аgile методологии в управлении командой
- Знание этапов разработки ПО
- Управление проектами
- Принципы дизайн-мышления
Мне нравится работать в команде, учиться друг у друга, мотивировать и достигать общие цели. 
Мои сильные стороны - это способность анализировать функционирование бизнес-процессов, данные статистики и определять эффективность процессов и ответственных за них людей. Обладаю способностью видеть долгосрочные перспективы, которые имеют потенциал принести пользу как компании, так и обществу.
Увлекаюсь изучением искусства и походами на выставки. 
"
0,23,Мужчина,Турция,Product marketing manager,Руководитель проектов,,Высшее образование (Магистр),,"['Русский', 'Английский', 'Испанский']",1,"[""['Miro'"", "" 'API'"", "" 'Trello'"", "" 'IDEF0'"", "" 'Jira'"", "" 'WordPress'"", "" 'Планирование рекламных кампаний'"", "" 'Digital Marketing'"", "" 'Account Management'"", "" 'Анализ рынка'"", "" 'Запуск новых продуктов'"", "" 'Стратегический маркетинг'"", "" 'Scrum'"", "" 'Agile Project Management'"", "" 'Разработка технических заданий'"", "" 'Управление разработкой'"", "" 'Методология проектов'"", "" 'Контроль качества'"", "" 'Формирование ТЗ для разработки'"", "" 'Управление бюджетом проекта'"", "" 'Организаторские навыки'"", "" 'Team management'"", "" 'Формирование проектной команды'"", "" 'Управление бизнес процессами'"", "" 'Управление продуктом'"", "" 'Прототипирование'"", "" 'A/B тесты'"", "" 'CJM'"", "" 'CustDev'"", "" 'User Story']""]","Мой опыт работы продукт менеджером/проджект менеджером в целом составляет 3 года. За это время я вырос х10 раз, но не готов останавливаться на достигнутом. У меня есть хороший опыт руководства командой до 20 человек, внедрение и развитие, как действующих так и новых продуктов.
Системный подход к работе
Целостное понимание маркетинга и разработки
Компетентен в широком спектре областей, целеустремлен, люблю трудные задачи, саморазвитие изо дня в день. "
1,35,Мужчина,Турция,"Моушен дизайн, режиссер монтажа","Дизайнер, художник",,Высшее образование,7,"['Русский', 'Английский']",0,"[""['Adobe Photoshop'"", "" 'Adobe Illustrator'"", "" 'Final Cut'"", "" 'Sony Acid'"", "" 'Видеомонтаж'"", "" 'Видеосъемка'"", "" 'Adobe After Effect'"", "" 'Adobe Premier Pro'"", "" 'Креативность'"", "" 'Обработка видео'"", "" 'Работа в команде'"", "" 'Графический дизайн']""]","В видеопроизводстве 13 лет. Успел поработать на всех этапах, начиная с разработки идеи, заканчивая motion design. Поэтому знаю всё от и до, как работает продакшн, в том числе и работа с клиентом. 
За это время преуспел в видеосъёмке, в монтаже и в моушен дизайне. Последнее мне интересно сейчас больше всего и есть желание развиваться в этом направлении. 
Владею профессиональными программами: 
After Effect, Illustrator, Premier, Photoshop, Figma.
Не пугает изучение других программ, т.к быстро и легко могу освоить основной функционал.
Главные мои достоинства - это ответственность и перфекционизм. Эти качества помогают мне делать работу на высоком уровне, а богатым опытом в индустрии компенсируется время на ее выполнение."
2,25,Мужчина,Турция,Инженер,"Инженер-конструктор, инженер-проектировщик",,Высшее образование (Магистр),,"['Русский', 'Английский']",0,"[""['SolidWorks'"", "" 'T-FLEX'"", "" 'Станки ЧПУ'"", "" 'ЕСКД'"", "" 'Рабочая документация'"", "" 'Проектная документация'"", "" 'Чтение чертежей'"", "" 'Исполнительная документация'"", "" 'Опыт работы в SolidWorks'"", "" 'MS Excel'"", "" 'MS Word'"", "" 'MS Paint'"", "" 'MS Access'"", "" 'MS Visio'"", "" 'MS PowerPoint'"", "" 'G-CODE'"", "" 'Fusion 360'"", "" 'Работа с большим объемом информации'"", "" 'Работа с оргтехникой'"", "" 'Пользователь ПК']""]","Личный качества: обучаемость; исполнительность; внимательность, усидчивость и умение выполнять рутинную работу."
3,23,Женщина,Турция,Удаленный сотрудник,"Менеджер по продажам, менеджер по работе с клиентами",,Неоконченное высшее образование,,"['Русский', 'Английский']",1,"[""['Деловое общение'"", "" 'Поиск и привлечение клиентов'"", "" 'Английский язык'"", "" 'Грамотная речь'"", "" 'Стрессоустойчивость'"", "" 'Пользователь ПК'"", "" 'Деловая коммуникация'"", "" 'Навыки продаж'"", "" 'Холодные звонки']""]","Участвовала более чем в 250 успешных сделках по аренде и продаже недвижимости.
Лично развивала клиентскую базу компании, вела деловые переписки, размещала рекламные объявления на различных платформах и продавала  услуги компании посредством телефонии и переписки. Работала с документацией, составляла и собирала документы для аренды и продажи недвижимости. 
Работая учителем в Тайланде,  успешно развивала и выстраивала взаимоотношения в международной и межнациональной среде. Помогала в продвижении и продажам услуг детского сада, привлекала новых клиентов  посредствам ведения странички в социальных сетях, онлайн рассылках, участии в локальных тематических ярмарках. Организовывала, прописывала и  проводила летние программы для групп детей разных возрастов и национальностей. 
Искренне верю что “терпение и труд все перетрут”. Всегда стремлюсь к результату. Быстрое освоение новых навыков, информации и самостоятельность, выделяет меня среди других.
На данный момент, желаю приобрести больше опыта и навыков в сфере торговли, услугами или товаром, но готова рассмотреть и другие предложения.
"
4,27,Мужчина,Турция,Expert C/C++ Backend | Solidity Blockchain Developer,"Программист, разработчик",,Высшее образование,,"['Русский', 'Английский']",1,"[""['Git'"", "" 'Docker'"", "" 'Kubernetes'"", "" 'Linux'"", "" 'Python'"", "" 'C++'"", "" 'C/C++'"", "" 'Assembler'"", "" 'C'"", "" 'Lua'"", "" 'Исполнительность'"", "" 'Обучаемость'"", "" 'Мотивация'"", "" 'Работа в команде'"", "" 'Unix'"", "" 'Mac'"", "" 'Mac Os'"", "" 'Windows'"", "" 'Solidity']""]","Ссылка на git - https://github.com/dpatrica
Основная информация:
Преподавал Python и lua в Roblox детям до 18 лет.
Успел поработать с микроконтроллерами (один год) (C/C++)
В настоящее время я работаю с блокчейном.
Пишу на C и C++ и немного на Python и Solidity.
Готов начать изучение любого нового для меня языка/стека, если мне понравится ваш проект.
_______________________________________
Дополнительная информация для интересующихся:
Всю жизнь увлекался и увлекаюсь физикой, математикой и информатикой. Люблю технику и любого рода автоматизацию. После школы, выбрав как дополнительные предметы для сдачи ЕГЭ - Физику и Информатику, поступил на бюджет в технологический университет с Физикой, отложив Информатику на будущее, т.к. знания в этой области были итак не плохие (всегда считал себя техническим программистом), а физика на тот момент была интереснее. Получив диплом, сразу же устроился на работу по специальности, стоял на станке с ЧПУ. Поработав так около 3- месяцев, понял, что эта работа явно не для меня. Слишком скучно и никакого развития, да и оплата была так себе, с сомнительными перспективами. Совсем не то, чего я хотел. Ушёл в IT. Первым делом, немного изучив сферу - запустил товарный бизнес, позже - долгое время занимался рекламой (smm), арбитражил. Через некоторое время меня пригласили работать в агентство по развитию проектов, прошло ещё немного времени и я стал ТимЛидом. Параллельно открывал свою кафешку (которая благополучно закрылась из-за пандемии и внутренних проблем). Решил, что пора возвращаться к истокам и всё кардинально менять. Окончательно бросил пить и курить, начал искать себе подходящее учебное заведение. Узнал, что есть некая французская школа 21 (aka school 42). Данная школа программирования отличается от остальных учебных заведений довольно сильно, обучение методом пир-ту-пир. Проектный формат. Мне это понравилось и я успешно прошёл вступительный месяц интенсива (там это называется бассейн). Поступив на основное обучение тут же начал усердно учиться. На данный момент прошло почти 3 года с начала основного обучения. Спустя полгода-год со старта я мог с уверенностью сказать, что очень хорошо знаю язык C. Написал на нём уже почти всё, что можно, включая псевдо 3D игру, реализовал свой bash, printf и многое другое. Также теперь есть знания C++ и Python. Очень нравится сфера машинного обучения и нейронных сетей. Хочу в дальнейшем связать с этим свою жизнь.
Ссылка на git - https://github.com/dpatrica
Спасибо."
5,28,Мужчина,Турция,Гейм-дизайнер,Гейм-дизайнер,,Высшее образование (Бакалавр),,"['Русский', 'Английский']",1,"[""['UI'"", "" 'Работа в команде'"", "" 'Геймдизайн'"", "" 'Unity'"", "" 'Тайм-менеджмент'"", "" 'Руководство коллективом'"", "" 'Управление проектами'"", "" 'Организаторские навыки'"", "" 'Tasks Tracking Sytems'"", "" 'MS Excel'"", "" 'Базы данных']""]","Занимаюсь геймдизайном последние 8 лет. Начинал с  создания настольных ролевых игр и игр живого действия. Работал в сфере разработки прикладных игр для образовательных учреждений. Разрабатывал компьютерные игры. Управлял командами разработки.
Имею активную жизненную позицию, вдохновляюсь творчеством разного толка. Считаю что игры - синтез множества видов искусства.
Общительный и рассудительный. Умею проводить свободное время как в компании, так и в одиночестве.
Самым важным капиталом в жизни считаю человеческие отношения.
Имею опыт в индивидуальном предпринимательстве, который научил меня принимать большую ответственность за себя и команду."
6,36,Мужчина,Астрахань,Руководитель юридического подразделения,Юрисконсульт,,Высшее образование,9,"['Русский', 'Английский', 'Турецкий']",1,"[""['Разработка регламентов'"", "" 'Управленческая отчетность'"", "" 'Разработка и внедрение политик и процедур'"", "" 'Управленческие навыки'"", "" 'Деловая переписка'"", "" 'Управление персоналом']""]","Желаю способствовать развитию перспективной компании.  
Оперативно и грамотно выполняю поставленные задачи. Способен доводить и воспринимать информацию, решать возникающие проблемы, планировать и организовывать рабочий процесс.
Надежный; придерживаюсь строгой рабочей этики; готов работать сверхурочно; способен учиться и работать в команде."
7,32,Male,Turkey,"Frontend developer(React js , React native)","Programmer, developer",,Higher education,0,"['Russian', 'English']",1,"[""['ООП'"", "" 'MySQL'"", "" 'MVC'"", "" 'Entity Framework'"", "" 'Git'"", "" 'ASP.NET CORE'"", "" 'React'"", "" 'React Native'"", "" 'Node.js'"", "" 'Redux'"", "" 'MobX'"", "" 'Next.js'"", "" 'Material UI'"", "" 'XML'"", "" 'CSS'"", "" 'SOLID'"", "" 'Redux-saga'"", "" 'C#'"", "" 'SQL'"", "" 'JavaScript'"", "" 'TypeScript'"", "" 'MS Visual Studio'"", "" 'Visual Studio C#'"", "" 'Web Application Development'"", "" 'HTML'"", "" 'ASP.NET'"", "" 'Razor pages'"", "" 'WEB API'"", "" 'Js'"", "" 'Jira']""]","I plunged into the study of programming in C #, preferring web development, and in particular ASP.Net Core. As a result, I worked on a large project on ASP.Net Core. Worked with Jira and GitHub. Now I am working with React.js and React Native, and I would like to develop in this direction.
At my new job, the main thing for me is gaining knowledge.
Lead an active lifestyle (play in the amateur soccer league, play ukulele)
In people I appreciate the adequacy and sense of humor.
https://github.com/SupDanil
I will be glad to your suggestions)
Программирование я начал с изучения C#, отдав предпочтение веб-разработке, и в частности ASP.Net Core. В итоге я работал над большим проектом на ASP.Net Core. Работал с Jira и GitHub. Сейчас работаю с React.js и React Native, и хотелось бы развиваться в этом направлении.
На моей новой работе главное для меня – это получение знаний.
Веду активный образ жизни (играю в любительской футбольной лиге, играю на укулеле)
В людях ценю адекватность и чувство юмора.
https://github.com/SupDanil
Буду рад вашим предложениям)"
8,25,Женщина,Турция,Product manager,Руководитель проектов,,Высшее образование,,"['Русский', 'Английский']",1,"[""['A/B тесты'"", "" 'Growth Hacking'"", "" 'CJM'"", "" 'Roadmap'"", "" 'Miro'"", "" 'Asana'"", "" 'Amplitude'"", "" 'Notion'"", "" 'Atlassian Jira'"", "" 'Tableau'"", "" 'Atlassian Confluence'"", "" 'JTBD'"", "" 'Market Research'"", "" 'Анализ целевой аудитории'"", "" 'Анализ рынка'"", "" 'Запуск новых продуктов'"", "" 'Agile Project Management'"", "" 'Управление разработкой'"", "" 'Приоритизация бэклога'"", "" 'Управление бюджетом проекта'"", "" 'Business Strategy'"", "" 'Business Analysis'"", "" 'CustDev'"", "" 'User Story'"", "" 'Customer Journey Map'"", "" 'Проверка гипотез'"", "" 'Продуктовая аналитика'"", "" 'Проектирование пользовательских интерфейсов'"", "" 'Английский язык']""]",
