,birth_date,gender,area,title,specialization,salary,education_level,education,language,experience,skill_set,skills
249,29,Женщина,Турция,Комьюнити-менеджер,"Менеджер по продажам, менеджер по работе с клиентами",,Высшее образование,2,"['Русский', 'Немецкий', 'Татарский']",1,"[""['Грамотная речь'"", "" 'Деловое общение'"", "" 'Организаторские навыки'"", "" 'Управление проектами'"", "" 'Работа в команде'"", "" 'Умение работать в команде'"", "" 'Креативность'"", "" 'Навыки межличностного общения'"", "" 'Социальные сети'"", "" 'Грамотность'"", "" 'Оперативный поиск информации в сети Интернет'"", "" 'Деловая переписка']""]","Личные качества:
• Легко обучаемая. Могу быстро погрузиться в любой контекст.
• Умею работать в команде. Легко налаживаю контакт с коллегами и руководством.
• Трудолюбивая. Полностью погружаюсь в рабочие процессы.
• Коммуникабельная. Умею общаться с людьми и избегать конфликтных ситуаций.
"
250,33,Женщина,Турция,Администратор,Администратор,,Образование,[],['Русский'],0,"[""['Умение работать в команде'"", "" 'оформление документации']""]",
251,37,Мужчина,Турция,Главный специалист,Руководитель проектов,,Высшее образование,4,"['Казахский', 'Английский', 'Русский', 'Турецкий']",0,"[""['Windows Server 2008/12 (Active Directory"", ' DNS', ' DHCP', "" WSUS)'"", "" 'McAfee (ePolicy Orchestrator"", ' DLP', ' McAfee Web Gateway', "" Solidcore)'"", "" '1С: Управление Производственным Предприятием'"", "" '1С ТОиР'"", "" '1С: Документооборот']""]","Ответственный, пунктуальный, коммуникабельный, вредных привычек не имею."
252,28,Male,Turkey,System administrator,System administrator,,Higher education,,"['Russian', 'English']",0,"[""['Администрирование сетевого оборудования'"", "" 'Администрирование серверов'"", "" 'Active Directory'"", "" 'Настройка ПК'"", "" 'Настройка ПО'"", "" 'Настройка серверов'"", "" 'Настройка сетевых подключений'"", "" 'Cisco'"", "" 'PowerShell'"", "" 'Linux'"", "" 'Администрирование серверов Linux'"", "" 'IPv6'"", "" 'VMware'"", "" 'VCenter'"", "" 'Zabbix'"", "" 'OpenVPN'"", "" 'GitLab'"", "" 'PostgreSQL'"", "" 'Docker'"", "" 'TCP/IP'"", "" 'Английский язык'"", "" 'Computer troubleshooting'"", "" 'Bash'"", "" 'Администрирование серверов Windows'"", "" 'VPN'"", "" 'Git'"", "" 'CI/CD'"", "" 'Debian'"", "" 'Nginx']""]","I am a system administrator and network engineer with 5 years of experience in configuring and managing networks and server infrastructure. My areas of expertise are administration domain users and group policies, network security, security audit, cloud storage, containerizations, CI/CD, monitoring infrastructure, VPN, IPv6, virtualization, and automatization. I also worked for 2 years as an IT instructor, which gave me experience in people and team management, problem-solving and event management. I am reliable, keen on detail, focused on success, self-motivated, and eager to learn new."
253,26,Женщина,Турция,Менеджер по рекламе,"Менеджер по маркетингу, интернет-маркетолог",,Высшее образование,,"['Русский', 'Английский']",0,"[""['Аналитика продаж'"", "" 'Развитие продаж'"", "" 'Internet Marketing'"", "" 'Управление проектами'"", "" 'Управление персоналом'"", "" 'Анализ бизнес показателей'"", "" 'SWOT анализ'"", "" 'WEB аналитика'"", "" 'Управление продуктовой матрицей'"", "" 'Маркетинговая стратегия'"", "" 'B2C маркетинг'"", "" 'Анализ ассортиментной линейки'"", "" 'Медиапланирование'"", "" 'Интернет-реклама']""]","Мои основные инструменты:
- Яндекс Метрика, Google Analytics, Simillar Web, Я. Wordstat, G.Trends
- Метрики CAC, CRR, CR, CRC, RPR
- Для изучения покупателей — RFM, QFD
- Работа с CJM
- Для изучения маркетинга как системы - расчёт 6 сигм
- Для трекинга задач, документации и вообще всего использую Notion
Дополнительные навыки:
- Аgile методологии в управлении командой
- Знание этапов разработки ПО
- Управление проектами
- Принципы дизайн-мышления
Мне нравится работать в команде, учиться друг у друга, мотивировать и достигать общие цели. 
Мои сильные стороны - это способность анализировать функционирование бизнес-процессов, данные статистики и определять эффективность процессов и ответственных за них людей. Обладаю способностью видеть долгосрочные перспективы, которые имеют потенциал принести пользу как компании, так и обществу.
Увлекаюсь изучением искусства и походами на выставки. 
"
254,43,Мужчина,Турция,Ведущий экономист,Экономист,,Высшее образование,18,"['Русский', 'Английский', 'Туркменский']",1,"[""['Работоспособность']""]","Высокая работоспособность, активная жизненная позиция, ответственность, 
стрессоустойчивость, творческий подход к работе, нацеленность на результат, готовность к ненормированному рабочему дню. 
."
0,38,Женщина,Красноярск,Главный менеджер по работе с клиентами. Помощник психолога,Психолог,,Высшее образование,,['Русский'],0,"[""['Умение везти переговоры'"", "" 'Организации мероприятий'"", "" 'Выявление потребностей клиентов'"", "" 'Проводить переговоры'"", "" 'Организация и управление'"", "" 'Написание постов']""]","Ответственность,  креативность, внимание к деталям, пунктуальность, творческий подход, умение работать в команде, брать ответственность,  лидерство- умение вести за собой  , коммуникабельность и организация рабочего процесса."
1,37,Male,UAE,"Team manager \ Hospitality, concierge business","Sales manager, account manager",,Higher education,10,"['Russian', 'English', 'German']",1,"[""['Sales Management'"", "" 'MS Outlook'"", "" 'Sales Skills'"", "" 'Windows Os'"", "" 'MS Office'"", "" 'Driving Licence B'"", "" 'Opera'"", "" 'Adobe Photoshop'"", "" 'Teambuilding'"", "" 'Presentation skills'"", "" 'Internet'"", "" 'Sabre'"", "" 'Time management'"", "" 'Business English'"", "" 'Phone Calls'"", "" 'Management Skills'"", "" 'Business Etiquette'"", "" 'Luxury products'"", "" 'Tableau'"", "" 'Genesys'"", "" 'ICBM']""]","Skilled with Tableau, ICBM, Genesys, Micros, Sabre, Fidelio, Amadeus systems, OPERA, Concierge Assistant, Apple Mac OS, Microsoft Windows,
Microsoft Office, Corel Draw, Adobe Photoshop etc. Advanced Internet skills
References available upon request.
Have a driver license. 
Ready for making the business trips. 
Fond of pro photography, cooking, music and travelling."
2,25,Женщина,Турция,Product manager,Руководитель проектов,,Высшее образование,,"['Русский', 'Английский']",1,"[""['Miro'"", "" 'Asana'"", "" 'Amplitude'"", "" 'Notion'"", "" 'Atlassian Jira'"", "" 'Tableau'"", "" 'JTBD'"", "" 'Agile Project Management'"", "" 'Google Sheets'"", "" 'Figma'"", "" 'Английский язык']""]",
3,32,Мужчина,Турция,Технический специалист,"Сервисный инженер, инженер-механик",,Высшее образование,1,"['Русский', 'Английский']",0,"[""['Компас-3D'"", "" 'MS Office'"", ' \'НПК ""Альфа""\'', "" 'ПДКУ ОКО'"", "" 'SAP CRM']""]","Целеустремлённый,амбициозный,способный перерабатывать большое количество информации за короткие сроки!"
4,30,Женщина,Москва,Флорист,Другое,,Высшее образование (Магистр),2,"['Русский', 'Английский']",0,"[""['Охрана труда и техника безопасности'"", "" 'Работа с людьми'"", "" 'Навыки межличностного общения'"", "" 'Работа с документами'"", "" 'Работа в команде'"", "" 'Деловая коммуникация'"", "" 'Умение работать в коллективе'"", "" 'Пользователь ПК'"", "" 'Internet'"", "" 'Работа с оргтехникой'"", "" 'Аналитическое мышление'"", "" 'Ведение переговоров'"", "" 'MS PowerPoint'"", "" 'Английский язык'"", "" 'MS Outlook'"", "" 'Грамотная речь'"", "" 'Управленческие навыки'"", "" 'Телефонные переговоры'"", "" 'Работа с большим объемом информации'"", "" 'Навыки презентации'"", "" 'Умение работать в команде'"", "" 'Организаторские навыки'"", "" 'Деловое общение'"", "" 'Корпоративная этика'"", "" 'Проведение презентаций'"", "" 'Подготовка презентаций'"", "" 'Ориентация на результат'"", "" 'Работа с жалобами клиентов'"", "" 'Государственные структуры'"", "" 'Мобильность']""]","Профессию свою очень люблю и крайне рада  стечению обстоятельств, которые привели меня во флористику. 
Каждая работа - индивидуальность 
Каждый букет - история. 
Я человек открытый, коммуникабельный, трудолюбивый и очень пунктуальный)
Активная жизненная позиция - в прямом и переносном смысле. 
Без спорта своей жизни не представляю."
5,20,Мужчина,Турция,Ретушер,"Фотограф, ретушер",,Среднее специальное образование,,"['Русский', 'Английский', 'Казахский', 'Татарский']",0,"[""['Ретушь предметных и модельных фотограф'"", "" 'Английский язык'"", "" 'Ведение карточки товара на маркетплейсе'"", "" 'Adobe Lightroom'"", "" 'Adobe Photoshop'"", "" 'Уверенный пользователь ПК'"", "" 'Понимание устройства ПК'"", "" 'Создание сайтов на базе WordPress']""]","Имею опыт работы с обработкой предметных и модельных фотографий. Работал ретушёром и выпускающим редактором в KazanExpress. 
Гражданство РФ, хорошо знаю английский."
6,27,Мужчина,Турция,Expert C/C++ Backend | Solidity Blockchain Developer,"Программист, разработчик",,Высшее образование,,"['Русский', 'Английский']",1,"[""['Git'"", "" 'Docker'"", "" 'Kubernetes'"", "" 'Linux'"", "" 'Python'"", "" 'C++'"", "" 'C/C++'"", "" 'Assembler'"", "" 'C'"", "" 'Lua'"", "" 'Исполнительность'"", "" 'Обучаемость'"", "" 'Мотивация'"", "" 'Работа в команде'"", "" 'Unix'"", "" 'Mac'"", "" 'Mac Os'"", "" 'Windows'"", "" 'Solidity']""]","Ссылка на git - https://github.com/dpatrica
Основная информация:
Преподавал Python и lua в Roblox детям до 18 лет.
Успел поработать с микроконтроллерами (один год) (C/C++)
В настоящее время я работаю с блокчейном.
Пишу на C и C++ и немного на Python и Solidity.
Готов начать изучение любого нового для меня языка/стека, если мне понравится ваш проект.
_______________________________________
Дополнительная информация для интересующихся:
Всю жизнь увлекался и увлекаюсь физикой, математикой и информатикой. Люблю технику и любого рода автоматизацию. После школы, выбрав как дополнительные предметы для сдачи ЕГЭ - Физику и Информатику, поступил на бюджет в технологический университет с Физикой, отложив Информатику на будущее, т.к. знания в этой области были итак не плохие (всегда считал себя техническим программистом), а физика на тот момент была интереснее. Получив диплом, сразу же устроился на работу по специальности, стоял на станке с ЧПУ. Поработав так около 3- месяцев, понял, что эта работа явно не для меня. Слишком скучно и никакого развития, да и оплата была так себе, с сомнительными перспективами. Совсем не то, чего я хотел. Ушёл в IT. Первым делом, немного изучив сферу - запустил товарный бизнес, позже - долгое время занимался рекламой (smm), арбитражил. Через некоторое время меня пригласили работать в агентство по развитию проектов, прошло ещё немного времени и я стал ТимЛидом. Параллельно открывал свою кафешку (которая благополучно закрылась из-за пандемии и внутренних проблем). Решил, что пора возвращаться к истокам и всё кардинально менять. Окончательно бросил пить и курить, начал искать себе подходящее учебное заведение. Узнал, что есть некая французская школа 21 (aka school 42). Данная школа программирования отличается от остальных учебных заведений довольно сильно, обучение методом пир-ту-пир. Проектный формат. Мне это понравилось и я успешно прошёл вступительный месяц интенсива (там это называется бассейн). Поступив на основное обучение тут же начал усердно учиться. На данный момент прошло почти 3 года с начала основного обучения. Спустя полгода-год со старта я мог с уверенностью сказать, что очень хорошо знаю язык C. Написал на нём уже почти всё, что можно, включая псевдо 3D игру, реализовал свой bash, printf и многое другое. Также теперь есть знания C++ и Python. Очень нравится сфера машинного обучения и нейронных сетей. Хочу в дальнейшем связать с этим свою жизнь.
Ссылка на git - https://github.com/dpatrica
Спасибо."
7,35,Мужчина,Турция,"Моушен дизайн, режиссер монтажа","Дизайнер, художник",,Высшее образование,7,"['Русский', 'Английский']",0,"[""['Adobe Photoshop'"", "" 'Adobe Illustrator'"", "" 'Final Cut'"", "" 'Sony Acid'"", "" 'Видеомонтаж'"", "" 'Видеосъемка'"", "" 'Adobe After Effect'"", "" 'Adobe Premier Pro'"", "" 'Креативность'"", "" 'Обработка видео'"", "" 'Работа в команде'"", "" 'Графический дизайн']""]","В видеопроизводстве 13 лет. Успел поработать на всех этапах, начиная с разработки идеи, заканчивая motion design. Поэтому знаю всё от и до, как работает продакшн, в том числе и работа с клиентом. 
За это время преуспел в видеосъёмке, в монтаже и в моушен дизайне. Последнее мне интересно сейчас больше всего и есть желание развиваться в этом направлении. 
Владею профессиональными программами: 
After Effect, Illustrator, Premier, Photoshop, Figma.
Не пугает изучение других программ, т.к быстро и легко могу освоить основной функционал.
Главные мои достоинства - это ответственность и перфекционизм. Эти качества помогают мне делать работу на высоком уровне, а богатым опытом в индустрии компенсируется время на ее выполнение."
8,34,Мужчина,Турция,Графический дизайнер. UI/UX-дизайнер,"Дизайнер, художник",,Высшее образование,4,"['Русский', 'Английский']",1,"[""['Adobe Photoshop'"", "" 'Adobe Illustrator'"", "" 'Adobe InDesign'"", "" 'Tilda'"", "" 'Figma'"", "" 'UX'"", "" 'UI'"", "" 'Bitrix24'"", "" 'Графический дизайн'"", "" 'Системное мышление'"", "" 'Ориентация на результат'"", "" 'Поиск оптимального решения'"", "" 'Ответственность'"", "" 'Способность к развитию']""]","Личные качества: быстрая обучаемость, высокая работоспособность, умение работать в команде, умение находить эффективные решения и работать на результат, умение проявлять инициативу, порядочность.
Профессиональные качества: 
— большой практический опыт в графическом дизайне, насмотренность в композиции, колористике, шрифтовых сочетаний;
— теоретический и небольшой практический опыт дизайна в WEB и прототипировании интерфейсов.
Хобби: сноуборд, туризм, фитнес.
В настоящее время активно развиваюсь в UX/UI дизайне, учусь прототипировать интерфейсы."
9,33,Мужчина,Турция,3D-моделлер(удаленно),"Дизайнер, художник",,Среднее специальное образование,7,"['Русский', 'Английский', 'Турецкий']",1,"[""['Adobe Photoshop'"", "" 'ZBrush'"", "" 'keyshot'"", "" '3D Моделирование'"", "" '3ds Max'"", "" 'Matrix'"", "" 'Rhinoceros 3D'"", "" 'Разработка эскизов']""]","
Знание софта
Photoshop, 3Ds Max, Magics, Zbrush. Keyshot, Rhinoceros
Substance Painter.
+ разработка концептов, эскизов
Свободно говорю на Английском, на базовом уровне Турецкий.
Занимаюсь спортом и люблю путешествовать."
10,30,Мужчина,Турция,Инженер,"Инженер по охране труда и технике безопасности, инженер-эколог",,Высшее образование,3,"['Русский', 'Английский']",1,"[""['Коммуникабельность'"", "" 'Ответственность'"", "" 'Работа в команде'"", "" 'Компас-3D'"", "" 'способность принимать взвешенные решения'"", "" 'адекватные действия в нештатных ситуациях'"", "" 'стремление к самообучению'"", "" 'готовность к командировкам'"", "" 'Mc office'"", "" 'Пользователь ПК'"", "" 'Водительское удостоверение категории B']""]","Люблю активный отдых,играть и смотреть хоккей. Общительный,веселый,жизнерадостный."
11,51,Мужчина,Турция,Руководитель сервисной службы,Начальник производства,,Высшее образование,1,"['Русский', 'Английский']",0,"[""['Отличные знания легкового и грузового автотранспорта. Диагностика"", ' сервис гидравлики', "" электрики']""]","Отличные знания в области пневматики и механики. Опыт работы.
Готов на любые проверки по  знаниям в области техники.
Можно по телефону или скайпу пройти предварительное интервью по знаниям. 
Прошел обучение в Южной Корее по изучению роботизированной промышленной электроники , а также, по монтажу и наладке производственной линии по выпуску источников резервного питания на основе литий-ионных аккумуляторов. Есть диплом."
